{
	"$schema": "../schemas/dialogue.schema.json",
	"id": "act1_syndicate_drop",
	"act": 1,
	"participants": ["player", "vera"],
	"entry": "settle",
	"nodes": {
		"settle": {
			"speaker": "vera",
			"text_key": "dlg.vera.drop.settle",
			"conditions": [{ "type": "story_flag", "flag": "act1_syndicate_drop_played", "value": false }],
			"next": "hint"
		},
		"hint": {
			"speaker": "vera",
			"text_key": "dlg.vera.drop.hint",
			"choices": [
				{
					"id": "take",
					"text_key": "dlg.vera.drop.choice.take",
					"conditions": [],
					"effects": [
						{ "type": "story_flag", "flag": "syndicate_drop_taken", "value": true },
						{ "type": "mood", "target": "vera", "delta": 0.1 }
					],
					"next": "taken"
				},
				{
					"id": "ask",
					"text_key": "dlg.vera.drop.choice.ask",
					"conditions": [],
					"effects": [
						{ "type": "story_flag", "flag": "syndicate_drop_asked", "value": true },
						{ "type": "mood", "target": "vera", "delta": -0.1 }
					],
					"next": "asked"
				},
				{
					"id": "refuse",
					"text_key": "dlg.vera.drop.choice.refuse",
					"conditions": [],
					"effects": [{ "type": "story_flag", "flag": "syndicate_drop_refused", "value": true }],
					"next": "refused"
				}
			]
		},
		"taken": {
			"speaker": "vera",
			"text_key": "dlg.vera.drop.taken",
			"effects": [{ "type": "story_flag", "flag": "act1_syndicate_drop_played", "value": true }],
			"end": true
		},
		"asked": {
			"speaker": "vera",
			"text_key": "dlg.vera.drop.asked",
			"effects": [{ "type": "story_flag", "flag": "act1_syndicate_drop_played", "value": true }],
			"end": true
		},
		"refused": {
			"speaker": "vera",
			"text_key": "dlg.vera.drop.refused",
			"effects": [{ "type": "story_flag", "flag": "act1_syndicate_drop_played", "value": true }],
			"end": true
		}
	}
}
