{
	"$schema": "../schemas/dialogue.schema.json",
	"id": "act1_station_blind_eye",
	"act": 1,
	"participants": ["player", "agnes"],
	"entry": "rent_day",
	"nodes": {
		"rent_day": {
			"speaker": "agnes",
			"text_key": "dlg.agnes.rent.arrive",
			"conditions": [{ "type": "story_flag", "flag": "act1_station_blind_eye_played", "value": false }],
			"next": "hint"
		},
		"hint": {
			"speaker": "agnes",
			"text_key": "dlg.agnes.rent.hint",
			"choices": [
				{
					"id": "nod_understood",
					"text_key": "dlg.agnes.rent.choice.nod",
					"conditions": [],
					"effects": [
						{ "type": "story_flag", "flag": "station_understood", "value": true },
						{ "type": "mood", "target": "agnes", "delta": 0.1 }
					],
					"next": "understood"
				},
				{
					"id": "play_dumb",
					"text_key": "dlg.agnes.rent.choice.play_dumb",
					"conditions": [],
					"effects": [{ "type": "story_flag", "flag": "station_blind_eye_unremarked", "value": true }],
					"next": "dumb"
				},
				{
					"id": "refuse",
					"text_key": "dlg.agnes.rent.choice.refuse",
					"conditions": [],
					"effects": [
						{ "type": "story_flag", "flag": "station_blind_eye_refused", "value": true },
						{ "type": "mood", "target": "agnes", "delta": -0.1 }
					],
					"next": "bristled"
				}
			]
		},
		"understood": {
			"speaker": "agnes",
			"text_key": "dlg.agnes.rent.understood",
			"effects": [{ "type": "story_flag", "flag": "act1_station_blind_eye_played", "value": true }],
			"end": true
		},
		"dumb": {
			"speaker": "agnes",
			"text_key": "dlg.agnes.rent.dumb",
			"effects": [{ "type": "story_flag", "flag": "act1_station_blind_eye_played", "value": true }],
			"end": true
		},
		"bristled": {
			"speaker": "agnes",
			"text_key": "dlg.agnes.rent.bristled",
			"effects": [{ "type": "story_flag", "flag": "act1_station_blind_eye_played", "value": true }],
			"end": true
		}
	}
}
